{
  "$schema": "../roadmaps.schema.json",
  "slug": "devops",
  "name": "DevOps",
  "icon": "🚀",
  "tagline": "Docker, K8s, CI/CD, observability",
  "status": "soon",
  "eta": "soon",
  "catalog_domain": "devops",
  "related_skills": [],
  "stages": [
    {
      "title": "Fundamentals",
      "items": [
        "Map drops soon"
      ],
      "status": "soon"
    },
    {
      "title": "Core",
      "items": [
        "Map drops soon"
      ],
      "status": "soon"
    },
    {
      "title": "Advanced",
      "items": [
        "Map drops soon"
      ],
      "status": "soon"
    },
    {
      "title": "Expert",
      "items": [
        "Map drops soon"
      ],
      "status": "soon"
    }
  ]
}
