{
  "$schema": "../roadmaps.schema.json",
  "slug": "backend",
  "name": "Backend",
  "icon": "⚙️",
  "tagline": "APIs, frameworks, runtimes, realtime",
  "status": "soon",
  "eta": "soon",
  "catalog_domain": "backend",
  "related_skills": [],
  "stages": [
    {
      "title": "Fundamentals",
      "items": [
        "Map drops soon"
      ],
      "status": "soon"
    },
    {
      "title": "Core",
      "items": [
        "Map drops soon"
      ],
      "status": "soon"
    },
    {
      "title": "Advanced",
      "items": [
        "Map drops soon"
      ],
      "status": "soon"
    },
    {
      "title": "Expert",
      "items": [
        "Map drops soon"
      ],
      "status": "soon"
    }
  ]
}
