{
  "$schema": "../roadmaps.schema.json",
  "slug": "security",
  "name": "Security",
  "icon": "🔒",
  "tagline": "OWASP, API security, secrets, OAuth",
  "status": "soon",
  "eta": "soon",
  "catalog_domain": "security",
  "related_skills": [],
  "stages": [
    {
      "title": "Fundamentals",
      "items": [
        "Map drops soon"
      ],
      "status": "soon"
    },
    {
      "title": "Core",
      "items": [
        "Map drops soon"
      ],
      "status": "soon"
    },
    {
      "title": "Advanced",
      "items": [
        "Map drops soon"
      ],
      "status": "soon"
    },
    {
      "title": "Expert",
      "items": [
        "Map drops soon"
      ],
      "status": "soon"
    }
  ]
}
