{
  "$schema": "../roadmaps.schema.json",
  "slug": "gamedev",
  "name": "GameDev",
  "icon": "🎮",
  "tagline": "Unity ECS, physics, gameplay",
  "status": "soon",
  "eta": "soon",
  "catalog_domain": "gamedev",
  "related_skills": [],
  "stages": [
    {
      "title": "Fundamentals",
      "items": [
        "Map drops soon"
      ],
      "status": "soon"
    },
    {
      "title": "Core",
      "items": [
        "Map drops soon"
      ],
      "status": "soon"
    },
    {
      "title": "Advanced",
      "items": [
        "Map drops soon"
      ],
      "status": "soon"
    },
    {
      "title": "Expert",
      "items": [
        "Map drops soon"
      ],
      "status": "soon"
    }
  ]
}
