{
  "$schema": "../roadmaps.schema.json",
  "slug": "engineering",
  "name": "Engineering",
  "icon": "🏗️",
  "tagline": "Architecture, TDD, review, git",
  "status": "soon",
  "eta": "soon",
  "catalog_domain": "engineering",
  "related_skills": [],
  "stages": [
    {
      "title": "Fundamentals",
      "items": [
        "Map drops soon"
      ],
      "status": "soon"
    },
    {
      "title": "Core",
      "items": [
        "Map drops soon"
      ],
      "status": "soon"
    },
    {
      "title": "Advanced",
      "items": [
        "Map drops soon"
      ],
      "status": "soon"
    },
    {
      "title": "Expert",
      "items": [
        "Map drops soon"
      ],
      "status": "soon"
    }
  ]
}
