{
  "$schema": "../roadmaps.schema.json",
  "slug": "design",
  "name": "Design",
  "icon": "🎨",
  "tagline": "Specs, diagrams, systems, taste",
  "status": "soon",
  "eta": "soon",
  "catalog_domain": "design",
  "related_skills": [],
  "stages": [
    {
      "title": "Fundamentals",
      "items": [
        "Map drops soon"
      ],
      "status": "soon"
    },
    {
      "title": "Core",
      "items": [
        "Map drops soon"
      ],
      "status": "soon"
    },
    {
      "title": "Advanced",
      "items": [
        "Map drops soon"
      ],
      "status": "soon"
    },
    {
      "title": "Expert",
      "items": [
        "Map drops soon"
      ],
      "status": "soon"
    }
  ]
}
