{
  "$schema": "../roadmaps.schema.json",
  "slug": "mobile",
  "name": "Mobile",
  "icon": "📱",
  "tagline": "Flutter, SwiftUI, Kotlin, React Native",
  "status": "soon",
  "eta": "soon",
  "catalog_domain": "mobile",
  "related_skills": [],
  "stages": [
    {
      "title": "Fundamentals",
      "items": [
        "Map drops soon"
      ],
      "status": "soon"
    },
    {
      "title": "Core",
      "items": [
        "Map drops soon"
      ],
      "status": "soon"
    },
    {
      "title": "Advanced",
      "items": [
        "Map drops soon"
      ],
      "status": "soon"
    },
    {
      "title": "Expert",
      "items": [
        "Map drops soon"
      ],
      "status": "soon"
    }
  ]
}
