{
  "$schema": "../roadmaps.schema.json",
  "slug": "finance",
  "name": "FinTech",
  "icon": "💹",
  "tagline": "Trading, risk, quant models",
  "status": "soon",
  "eta": "soon",
  "catalog_domain": "finance",
  "related_skills": [],
  "stages": [
    {
      "title": "Fundamentals",
      "items": [
        "Map drops soon"
      ],
      "status": "soon"
    },
    {
      "title": "Core",
      "items": [
        "Map drops soon"
      ],
      "status": "soon"
    },
    {
      "title": "Advanced",
      "items": [
        "Map drops soon"
      ],
      "status": "soon"
    },
    {
      "title": "Expert",
      "items": [
        "Map drops soon"
      ],
      "status": "soon"
    }
  ]
}
