{
  "$schema": "../roadmaps.schema.json",
  "slug": "desktop",
  "name": "Desktop",
  "icon": "🖥️",
  "tagline": "Electron, native apps",
  "status": "soon",
  "eta": "soon",
  "catalog_domain": "desktop",
  "related_skills": [],
  "stages": [
    {
      "title": "Fundamentals",
      "items": [
        "Map drops soon"
      ],
      "status": "soon"
    },
    {
      "title": "Core",
      "items": [
        "Map drops soon"
      ],
      "status": "soon"
    },
    {
      "title": "Advanced",
      "items": [
        "Map drops soon"
      ],
      "status": "soon"
    },
    {
      "title": "Expert",
      "items": [
        "Map drops soon"
      ],
      "status": "soon"
    }
  ]
}
