{
  "$schema": "../roadmaps.schema.json",
  "slug": "healthcare",
  "name": "Healthcare IT",
  "icon": "🏥",
  "tagline": "FHIR, HIPAA, integrations",
  "status": "soon",
  "eta": "soon",
  "catalog_domain": "healthcare",
  "related_skills": [],
  "stages": [
    {
      "title": "Fundamentals",
      "items": [
        "Map drops soon"
      ],
      "status": "soon"
    },
    {
      "title": "Core",
      "items": [
        "Map drops soon"
      ],
      "status": "soon"
    },
    {
      "title": "Advanced",
      "items": [
        "Map drops soon"
      ],
      "status": "soon"
    },
    {
      "title": "Expert",
      "items": [
        "Map drops soon"
      ],
      "status": "soon"
    }
  ]
}
