{
  "$schema": "../roadmaps.schema.json",
  "slug": "blockchain",
  "name": "Blockchain",
  "icon": "⛓️",
  "tagline": "ZK-proofs, protocols, dApps",
  "status": "soon",
  "eta": "soon",
  "catalog_domain": "blockchain",
  "related_skills": [],
  "stages": [
    {
      "title": "Fundamentals",
      "items": [
        "Map drops soon"
      ],
      "status": "soon"
    },
    {
      "title": "Core",
      "items": [
        "Map drops soon"
      ],
      "status": "soon"
    },
    {
      "title": "Advanced",
      "items": [
        "Map drops soon"
      ],
      "status": "soon"
    },
    {
      "title": "Expert",
      "items": [
        "Map drops soon"
      ],
      "status": "soon"
    }
  ]
}
