{
  "$schema": "../roadmaps.schema.json",
  "slug": "ai",
  "name": "AI / LLM",
  "icon": "🤖",
  "tagline": "Agents, RAG, evals, prompt, MCP",
  "status": "soon",
  "eta": "soon",
  "catalog_domain": "ai",
  "related_skills": [],
  "stages": [
    {
      "title": "Fundamentals",
      "items": [
        "Map drops soon"
      ],
      "status": "soon"
    },
    {
      "title": "Core",
      "items": [
        "Map drops soon"
      ],
      "status": "soon"
    },
    {
      "title": "Advanced",
      "items": [
        "Map drops soon"
      ],
      "status": "soon"
    },
    {
      "title": "Expert",
      "items": [
        "Map drops soon"
      ],
      "status": "soon"
    }
  ]
}
