{
  "$schema": "../roadmaps.schema.json",
  "slug": "embedded",
  "name": "Embedded",
  "icon": "🔌",
  "tagline": "Rust embedded, firmware",
  "status": "soon",
  "eta": "soon",
  "catalog_domain": "embedded",
  "related_skills": [],
  "stages": [
    {
      "title": "Fundamentals",
      "items": [
        "Map drops soon"
      ],
      "status": "soon"
    },
    {
      "title": "Core",
      "items": [
        "Map drops soon"
      ],
      "status": "soon"
    },
    {
      "title": "Advanced",
      "items": [
        "Map drops soon"
      ],
      "status": "soon"
    },
    {
      "title": "Expert",
      "items": [
        "Map drops soon"
      ],
      "status": "soon"
    }
  ]
}
