{
  "$schema": "../roadmaps.schema.json",
  "slug": "database",
  "name": "Databases",
  "icon": "🗄️",
  "tagline": "Postgres, Redis, Mongo, vectors",
  "status": "soon",
  "eta": "soon",
  "catalog_domain": "database",
  "related_skills": [],
  "stages": [
    {
      "title": "Fundamentals",
      "items": [
        "Map drops soon"
      ],
      "status": "soon"
    },
    {
      "title": "Core",
      "items": [
        "Map drops soon"
      ],
      "status": "soon"
    },
    {
      "title": "Advanced",
      "items": [
        "Map drops soon"
      ],
      "status": "soon"
    },
    {
      "title": "Expert",
      "items": [
        "Map drops soon"
      ],
      "status": "soon"
    }
  ]
}
